ID_project;ID_tot;category;id;degree;course;ay;school;school_website;IMMAGINI;Polarità;PIAZZATO;title;subtitle;description;old_description;team;faculty;project_website;Video;Link Video;hasVideo;video_link;Column 17;
FDV_ENA_4;FDV_ENA_4;ENA;4;BA (Hons) Industrial Design;;2024;University of Johannesburg, Faculty of Art, Design and Architecture (FADA), Johannesburg, South Africa;https://www.uj.ac.za;Cove;Enabling / Relieving;;Cove;Human-Centered Design of a Non-Medical Intervention for Children with ADHD;This project addresses the need for holistic, tangible tools that help children with ADHD establish and maintain routines while enabling caregivers to monitor and adjust treatment strategies effectively. The Cove system comprises three interconnected components: a physical routine planner with activity pebbles, a wearable reminder device, and an app, which work together to empower neurodivergent children by providing a structured framework that helps them manage their routines, regulate their emotions, simplify tracking and deal with daily activities, while also enhancing communication among parents, teachers, and therapists.;;Anya Erasmus;Ashton Moseley;;;;;;;
FDV_ENA_5;FDV_ENA_5;ENA;5;Bachelors Ddegree in Graphic Design;Graduation Project;2024;Latvian Art Academy, Design Department, Riga, Latvia;https://dizains.lma.lv/en;Raižplēsis;Enabling / Relieving;;Raižplēsis;Empwering Children To Overcome Medical Fears Through Stories and Play;Raižplēsis is a website with simple, easy-to-understand content designed for kids of different ages and abilities. It was born out of the intent to help children feel less scared about medical procedures while involving parents in the process. Through fun stories, games, and a friendly character, it helps children learn about medicine in a way that feels safe and playful. Parents are part of the journey too, making it a shared experience that brings comfort and understanding to families facing medical challenges.;;Jānis Kokarevičs, Elīna Pavlova;Maija Rozenfelde, Markus Rožkalns;https://drive.google.com/file/d/1ge3jiV6JzqOfRjiKRl7Fjk5NjAZ-jx2h/view?usp=sharing;YES - 1:53;https://drive.google.com/file/d/1ge3jiV6JzqOfRjiKRl7Fjk5NjAZ-jx2h/view?usp=sharing;file;https://drive.google.com/file/d/1ge3jiV6JzqOfRjiKRl7Fjk5NjAZ-jx2h/view?usp=sharing;;
FDV_ENA_6;FDV_ENA_6;ENA;6;Bachelor's Degree;Product and Innovation Design;2024;Pontifícia Universidade Católica - PUC Rio, Departamento de Artes e Design (DAD), Rio de Janeiro, Brasil;https://www.puc-rio.br/index.html;Project 01;Enabling / Relieving;;Balancê;Body Extensions, Identity Expression, and Well-Being of the Elderly;The Balancê walking support was created for elders who seek a more elegant and personalized alternative to traditional canes, which often fail to represent their identity. By integrating biomimicry and emotional design, it offers a natural, balanced gait while breaking the stigma associated with mobility aids. The project reimagines assistive devices as tools for dignity and self-expression, harmonizing practicality and individuality, redefining the relationship between users and the objects they rely on.;;Bruna Chambarelli Wolter;Augusto Seibel, Cláudia Kayat, Gabriella Vaccari;;YES - 0:47;https://drive.google.com/file/d/1HeiMjd7054_ESlKMDdKXpFyY8j9az25v/view?usp=sharing;file;https://drive.google.com/file/d/1HeiMjd7054_ESlKMDdKXpFyY8j9az25v/view?usp=sharing;;
FDV_ENA_7;FDV_ENA_7;ENA;7;BA (Hons) Industrial Design;;2024;University of Johannesburg, Faculty of Art, Design and Architecture (FADA), Johannesburg, South Africa;https://www.uj.ac.za;PillEase;Enabling / Relieving;;PillEase;Enhancing Medication Accessibility and Independence;PillEase is a multifunctional device designed to assist individuals with limited hand strength, including the elderly and those with conditions such as arthritis and Parkinson’s disease, in opening child-resistant pill bottles. Its ergonomic design minimizes hand strain, while an integrated pill cutter allows for precise dosage adjustments. Additionally, a built-in storage compartment provides convenient pill organisation. By addressing common challenges in medication management, PillEase enhances accessibility and ease of use in daily routines.;;Bongeka Buthelezi;Ashton Moseley;;;;;;;
FDV_ENA_8;FDV_ENA_8;ENA;8;MFA Advanced Product Design;Graduation Project;2024;Umeå Institute of Design, Umeå, Sweden;https://www.umu.se/en/umea-institute-of-design/;PAL;Enabling / Relieving;;PAL;Hybrid Arm Prosthetics;Amputees are often excluded and isolated due to bodily limitations and societal stigma. Prostheses can help them to live more independent, healthy and active lives and lets them be part of the society with lesser limitations. However, access to these devices is extremely limited, and even when they are accessible, prostheses are often not well accepted. The industry today focuses on high-tech products, while simpler, more affordable solutions are being mostly neglected. PAL focuses on ways to improve accessibility, functionality and acceptance. Designed in close collaboration with users, stakeholders and the company Agile Robots, the product combines advantages of both electric and mechanical prostheses in a low-cost, open-source and 3D-printable design. It allows for ergonomical, functional and aesthetic customization based on the users’ individual needs and desires.;;Heinrich Zaunschirm;Thomas Degn;https://www.umu.se/en/umea-institute-of-design/education/student-work/masters-programme-in-advanced-product-design/2024/heinrich-zaunschirm/;YES - 1:24;https://play.mediaflow.com/ovp/16/83LEUQ61UO;file;https://play.mediaflow.com/ovp/16/83LEUQ61UO;;
FDV_ENA_9;FDV_ENA_9;ENA;9;Master Design;Dissertation;2023/2024;University of Aveiro, Department of Communication and Art, Aveiro, Portugal;https://www.ua.pt/en/deca ;Sentimental information;Enabling / Relieving;;Sentimental Information;Designing Sentimental Information for Meaningful Connections;In an environment where access to information or data is increasingly easy, there are new challenges in finding quality information that is of interest to us. Today, the amount of information we have access to exceeds our capacity to absorb it, and our personal interest is what helps us keep abreast of this information, filtering it down to what is important to retain. Information is a driving force in the evolution of knowledge, which is why it is important to understand mechanisms that qualify its consumption. Against this backdrop, Sentimental Information arose an interest in the expressive register, and how it can be present in information design cohabiting with a technical dimension. Expression is also intrinsically present in design and offers clues for reflection on the challenges of information overload and interest.;;Rosa Bateira;Rui Costa;;;;;;;
FDV_FEW_1;FDV_FEW_1;FEW;1;Bachelor's Degree;Social Design Studio;2023/2024;Academy of Fine Arts in Warsaw, Faculty of Design, Warsaw, Poland;https://asp.waw.pl/;Project 02;For-Few / For-All;;Sensory Jewelry;Safe Tool for Emotional Regulation of Neurodivergent People;The Sensory Jewelry project is a response to the needs and adaptation mechanisms of neurodivergent people. It aims to provide a safe and discreet tool that supports emotional regulation for people with impaired sensory integration. Although society is becoming more compassionate towards individuals who go beyond broadly understood social norms, stigmatization is still a significant issue. Inclusive design is crucial not only to improving the lives of the few, but also sensitizing others to the challenges they face, allowing for society to reconnect and create a better environment for all.;;Michalina Wróblewska;Michał Stefanowski;;;;;;;
FDV_FEW_2;FDV_FEW_2;FEW;2;Bachelor of Science, Design + Environmental Analysis;Magnifying Small Spaces Studio;2024/2025 ;Cornell University, College of Human Ecology, Department of Human Centered Design, Ithaca, NY, United States of America;https://www.human.cornell.edu/hcd;Project 02;For-Few / For-All;;Space for Others;Intuitive Grammars for Inclusive Space-Making;Space for Others is an interdisciplinary design research studio exploring the dynamics of co-creating spaces, focusing on the balance of individual agency and collective collaboration. The project uses aggregate building systems and intuitive assembly grammars to explore this dichotomy. Through computational modeling, digital fabrication, and participatory play scenarios, the studio developed toy-scale, 3D printed prototypes for collaborative studies. These experiments consequently informed a full-scale kit, now tested in public play workshops to refine approaches to inclusivity, accessibility, and shared authorship.;;Riya Verma, Kalven Owen, Tioluwani Fabunmi, Keira Huffman, Andrea Porubcin, Iason Diogenous, Chloe Jung, Alice Huiwen Ho;Leighton Beaman;https://www.materialpropositions.org/space-for-others;A video can be produced to so assembly.;;;;;
FDV_FEW_3;FDV_FEW_3;FEW;3;Bachelor Degree;Design Thinking and Product Innovation;2024;Guangzhou Academy of Fine Arts,  DaVinci Innovation Academy, Guangzhou, China;https://www.gzarts.edu.cn/index.htm;Project 02;For-Few / For-All;Y;CREAJOR ;A Drawing Tool For Visually Impaired People;CREAJOR is an interactive design tailored to the drawing and reading habits of visually impaired students. Students can perceive images by touching a display screen with raised dots, supplemented by shortcut keys with voice prompts. These features cater to visually impaired people’s reliance on touch and hearing. Moreover, it includes an option to facilitate writing as well. To enable visually impaired students to draw freely, a user-friendly design, equipped with functional buttons aid in drawing and annotating with ease and precision. The CREAJOR pen utilizes an optical translation measurement sensor, allowing it to draw on any flat surface. The results are displayed in real-time on the dot matrix display screen, breaking spatial limitations and providing an enhanced drawing experience. A numeric keypad quantifies line lengths for precise drawing, while the pen’s unique triangular shape prevents it from rolling away. Additionally, its magnetic feature ensures the pen is always secure and within reach.;;Jin Wang, Ningning Zheng, Qian Luo;Xun Gao, Zaixing Liu, Li Gu, Zeqiang Yuan;;;;file;;;
FDV_FEW_4;FDV_FEW_4;FEW;4;Bachelor in Design;Capstone Project;2024;The University of Auckland - Waipapa Taumata Rau, Faculty of Engineering and Design, Auckland, New Zealand;https://www.auckland.ac.nz/en/creative/about-the-faculty/design-programme.html;Project 01;For-Few / For-All;;Raranga;Weaving Our Tangata Tiriti Journeys;Raranga is an educational gamified toolkit developed to equip kaimahi (employees) with the skills and knowledge to assist them as on their Tangata Tiriti (treaty partnership) journeys with the ultimate goal of improving Māori workplace satisfaction for better systemic outcomes. The kēmu (game) centers learning through collaboration, reflecting the traditional Māori art of Raranga (weaving). The practice weaves together individual strands of harakeke to create something stronger, symbolising the collective journey towards understanding and embodying Te Tiriti. Raranga breaks down the hierarchical power dynamics that exist within workplaces, creating a safe environment for collaboration and knowledge sharing.;;Leah Kampkes;Diana Albarran Gonzalez, Mairi Gunn, Ayla Hoeta, Gabriela Baron, Xin Cheng;https://redesign.ac.nz/projects/raranga-weaving-our-tangata-tiriti-journeys;NO, but the student could make one;;file;;;
FDV_FEW_5;FDV_FEW_5;FEW;5;Bachelor's Degree Program in Design;;2024/2025;Universidade Europeia, IADE, Lisbon, Portugal;https://www.iade.europeia.pt/;Mole;For-Few / For-All;;Mole;A Practical Kitchen;Mole consists of a kitchenware collection that combines functionality and aesthetic simplicity, reflecting contrasting ideas of exclusivity and accessibility. The design highlights the balance between personal, human-scale usability and broader considerations of sustainability and shared use. With minimalist forms, natural materials, and versatile finishes, the collection invites reflection on how objects can serve both individual needs and collective aspirations, blending elegance with practicality for everyday living.;;Sara Saramago, Inês Gama;João Bernarda, Pedro Oliveira, Miguel Soeiro;;;;;;;
FDV_FEW_6;FDV_FEW_6;FEW;6;Master of Design;Sustainable Solution Workshop;2023/2024;Illinois Tech, Institute of Design, Chicago, IL, United States of America;https://www.sustainablesolutions.design/    https://id.iit.edu/;Embedded Finance for a Cashless Society;For Few / For All;;Embedded Finance for a Cashless Society;Empowering Communities through Financial Systems;Embedded Finance for a Cashless Society explores how design can navigate exclusivity and inclusivity in embedded finance by creating flexible systems that broaden access while addressing unique needs. Inclusive design in a cashless society means balancing the accessibility of digital services with protections for those lacking digital access, bridging the gap for marginalized groups. By fostering alternative pathways, such as mobile banking and community-supported profiles, design mitigates disparities, ensuring financial tools are not only available but also adaptable, nurturing equity without reinforcing privilege.;;Avani Chaturvedi, Michael Ho, June Kulwadee Pruksananonda, Grace Parks Hall, Sanya Shah;Carlos Teixeira, Deaa Bataineh;https://www.sustainablesolutions.design/2024-embedded-finance-for-cashless-society;;;;;;
FDV_HAR_1;FDV_HAR_1;HAR;1;BA Interior Design;;2024;Latvian Art Academy, Faculty of Design, Riga, Latvia;https://www.lma.lv/en;Project 01;Harmony / Discord;;CVm2 ;Two Houses in Cēsis: Dolomite and Clay;CVm2 is a project continually shaped by contrasts, starting from the relationship between historical heritage and its role today, the clash of foreign memories and new experiences, and the tension between construction and destruction. The project focuses on repurposing the remnants of buildings bombed in 1944 consisting essentially exterior walls, one made of dolomite and the other of red brick, that were adapted for economic use in the post-war period, according to available resources. The sheds have now outlived their purpose, and the time has come to restore one of them to a residential function, while the other is to be introduced to that role. The study of construction materials, clay and dolomite, evolved into two interior concepts: Clay and Dolomite. The Clay plans to restore the shed’s residential function by creating two 34.5 m² rental apartments, while the Dolomite building will host a “holiday home” for families, with four levels for four people, resulting in s a space where communal living coexists with individual autonomy.;;Ieva Skuja-Zelča;Andra Šmite;https://www.fold.lv/en/2024/07/design-graduates-ieva-skuja-zelca/;;;;;;
FDV_HAR_2;FDV_HAR_2;HAR;2;MSc Interior and Spatial Design;Landscape and Interior - Spatial Design 2;2023/2024;Politecnico di Milano, School of Design, Milan, Italy;www.design.polimi.it;FDV_HAR_2;Harmony / Discord;;Courage is BREAKING THE BARRIERS;Design is Courage;Courage is BREAKING THE BARRIERS investigates barriers as sources of ambiguous attraction, tangling between the fear of pushing beyond them and the unrestrained desire of going further. In front of physical or mental barriers, the unknown and the desire to understand what goes beyond the immediate understanding raises a deep emotional response, often ambivalent. When barriers seem insurmountable, it might be just a small detail the one that allows you to go beyond. Such a small but game changing detail takes the shape of a refined play of joints combined with the lightness of the painted rice paper without any interference and with no aids, compose the main structure of the installation, leveraging one of the most archaic construction systems: the wedge. An act of courage is needed to unveil what’s beyond the barrier. One needs to bow, entering in a reserved and gathered dimension where a measured structure helps face adversity and four paper-thin suspended barriers protect and guide the visitor towards a bright monolith, accompanied by reasoned yet imprecise lines.;;Asia Bernardo, Fabiana Cosentino, Clara Maria Fabbri, Luca Rebonato;Michele De Lucchi, Francesca Balena Arista, Marco De Santi, Francesco Clerici, Giada Boromello, Nicolò Chierichetti, Alessia Soressi;;;;;;;
FDV_HAR_3;FDV_HAR_3;HAR;3;MA Graphic Design and Visualisation;;2024;Loughborough University, School of Design and Creative Arts, Loughborough, United Kingdom; https://www.lboro.ac.uk/ ;Project 01;Harmony / Discord;;Re-Viewing the Gaze;Unveiling Polarized Views on Gender, Sex, and Sexuality;Re-Viewing the Gaze challenges the polarized constructions of gender and identity, by critiquing expected societal norms and biases. Employing an interactive exhibition design, the cognitive tension between opposing worldviews is explored. This provokes viewers to rethink their rigid expectations, through facilitated visual and narrative means. The project asks viewers to actively shift their gaze, revealing the cognitive dissonance which would usually blind them to alternative thought.;;Jo Flint ;Simon Downs, Alis Iacob ;https://josflint.github.io/RE-VIEWING_THE_GAZE/;NO;;;;;
FDV_HAR_4;FDV_HAR_4;HAR;4;Bachelor of Interior Design (Honours);Research Major Project;2024;RMIT University, School of Architecture and Urban Design, Melbourne / Naarm , Australia;https://rmitinteriordesign.website/;Project 02;Harmony / Discord;;Commonplace;Spatial Tactics for the Urban Interior;Commonplace, a non-profit center for tactical urbanism, aims at resisting capitalist frameworks by amplifying the contributions of laborers whose efforts sustain from the boundaries. Using disobedient guerrilla tactics, it defines the urban interior as a collective common. Materialist culture, driven by relentless innovation, places the 1% at the center, relegating the 99% to the boundary. Commonplace urges a shift from self-interest to common interest, advocating for participation, agency, and acts of resistance to catalyze a care movement.;;Olivia Reiher;James Carey;;YES -  3:06;https://www.youtube.com/watch?v=it72xjkqfkc;youtube;it72xjkqfkc;;
FDV_HAR_5;FDV_HAR_5;HAR;5;Industrial Design - Spatial Design Specialization;Eco Conception;2024;STRATE, Sevres, France;https://www.strate.design/;VESTIGES;Harmony / Discord;;Vestiges;Archaeology of Skiing;With the imminent end of skiing, the mountains are being transformed into a journey through time. Vestiges reinvents these snowless landscapes by transforming the remnants of the 60s into an immersive adventure. Hikers will discover a new way of experiencing the mountains, combining simplicity and sobriety. This unique itinerary, far removed from conventional “hotel” refuges, introduces beginners to the wonders of nature and teaches them to respect the environment. It’s a new way of rediscovering the mountains, where every step tells a story and every view inspires.;;Martin Caillaut;Anne Bugugnani, Chloe Louisin;https://drive.google.com/file/d/1rUYFUfjLrIh5NSzUD3BqLr2kLP6TNGnY/view?usp=sharing;;;file;;;
FDV_HAR_6;FDV_HAR_6;HAR;6;BSc Interior Design;Final Synthesis Design Studio - Sect. 4;2024/2025;Politecnico di Milano, School of Design, Milan, Italy;www.design.polimi.it;DIVERSO DA ZERO - IRENE;Harmony / Discord;;Diverso da Zero;Disturbing Design;Diverso da Zero redesigns the square of Pieve del Cairo (Pavia) starting from an extraordinary event: a “splinter rain” that transformed the space. The disturbance created by the splinter rain became the starting point for creating dynamic and innovative spaces. Using sustainable materials such as rice waste fabric and rice fiber, environments that stimulate sociality and interaction were designed. New spatial functions, including play areas, art academies and community areas, turn the square into a unique space where citizens can live engaging experiences.;;Matilde Casadei, Alberto Distefano, Francesco Detomaso, Irene Dominici;Anna Anzani, Davide Crippa, Barbara Di Prete, Giacomo Attilio Carlo Gatti, Emilio Lonardo;;;;;;;
FDV_HUM_1;FDV_HUM_1;HUM;1;Bachelor's Degree;;2023/2024;Academy of Fine Arts in Warsaw, Faculty of Design, Warsaw, Poland;https://asp.waw.pl/;Project 03;Human  /  More Than Human;;Bio-diverse Enclaves;Returning Urban Spaces to the Local Biocenose;Bio-diverse Enclaves are spaces meant for the non-human residents of Warsaw. Its existence is made possible through bottom-up citizen initiatives and its construction does not require expertise in building or design. Made of a clay-composite, it enters into a relation with local organisms and is in turn shaped by them and the environment: the resultant cracks and crevices can be colonized by plants and invertebrates, the top of the structure can be a place for birds to rest and feed. The project is a space in which the work of humans can be given over to non-humans, and the dichotomy separating natural and artificial can be blurred.;;Zuzanna Szymłowska;Wojciech Małolepszy;;YES - 0:31;https://www.youtube.com/watch?v=eJ64zP5XEO8;youtube;eJ64zP5XEO8;;
FDV_HUM_2;FDV_HUM_2;HUM;2;Bachelor Degree;Capstone Project;2023;Guangzhou Academy of Fine Arts, School of Innovation Design, Guangzhou, China;https://www.gzarts.edu.cn/;Symbiotic Link;Human  /  More Than Human;Y;Symbiotic Link;Green Community Design for Oxygenated Microalgae;"Based on the exploratory construction scenario of the Tencent “Qi'e Island Future City"" project, Symbiotic Link focuses on soilless green plant cultivation and sustainable development in smart communities. 
By combining environmental science with social co-creation, Symbiotic Link leverages microalgae with efficient oxygen production performance as its core carrier, while also serving a green plant installation with viewing, resting, and social functions. Overall it is a systems of three elements: a spiritual cultivation algae bioreactor, an air purification system, and a visual air quality monitoring system, based on a simple to assemble structure that can adapt to different environments.";;Zizhen He;Zaixing Liu, Xun Gao, Li Gu, Zeqiang Yuan;;;;file;;;
FDV_HUM_3;FDV_HUM_3;HUM;3;BSc Industrial Design Engineering;Product Design;2023/2024;Kaunas University of Technology, Faculty of Mechanical Engineering and Design, KTU Design Centre, Kaunas, Lithuania;https://fmed.ktu.edu/dc/;Biodivercities II;Human  /  More Than Human;Y;Biodivercities II;Bringing Back Wilderness in Urban Regenerated Green Areas;Biodivercities II wants to address a growing global issue: the decline of insect pollinators in urban areas. Rapid urbanization and large-scale agriculture reduce food sources and nesting areas, threatening wild insects. Nonetheless, humans depend on biodiversity for clean air, water, and food, and cities can support insects by creating wildlife areas within their boundaries. Biodivercities II promotes urban biodiversity through an educational DIY toolkits for nesting sites.;;Justina Klėjūtė, Niccolò Lelli, Kotryna Lenkauskaitė, Hari Prasanna, Justė Motuzaitė, Giuseppe Donvito;Lorenzo Piazzi;;NO;;;;;
FDV_HUM_4;FDV_HUM_4;HUM;4;BSc Industrial Design Engineering;Bionics and Biomimicry in Design;2024;Kaunas University of Technology, Faculty of Mechanical Engineering and Design, KTU Design Centre, Kaunas, Lithuania;fmed.ktu.edu/dc;Super-humans II;Human  /  More Than Human;Y;Super-humans II;Is This a Machine Mistake, or Just Another Design?;"AI is striving to bridge the gap, yet it has not yet reached a level of development capable of bringing significant improvements to our daily lives at least not in the way biological intelligence already does in crucial fields such as nutrition, protection, and mobility. The so-called ""Datacene"" era is still far from becoming a reality, and this is not merely due to the relatively small amount of stored data that AI processes to learn. Territories within these blurred areas represent a stimulating theme for design and technology-related investigations. Super-humans II gives shape to a conversation that happened over a period of six months, born from a brainstorming and nature-exploration session with students in the natural reserve of Nida, on the Curonian Lagoon and later shared with generative parametric design software through prompting and iterations.";;Corrado Franceschini, Eugenija Tereščenko;Lorenzo Piazzi;;;;;;;
FDV_HUM_5;FDV_HUM_5;HUM;5;BA Interaction Design ;Interaction Design Studio;2024;National College of Art and Design (NCAD), Department of Product Design, Dublin, Ireland;https://www.ncad.ie/;Project 02;Human  /  More Than Human;Y;Plánta;Community Powered Coastal Protection;Coastal erosion is destroying homes all around Ireland. Communities struggle for coastal protection options that are attainable and respect biodiversity laws. Marram grass planting, a proven solution, has protected the town of the Maharees in the West of Ireland since 2016. Plánta provides the knowhow & community management capabilities of the Maharees community to all communities in Ireland, through programs that balance the needs of communities with biodiversity and regulation and allowing individuals to organize collective action for the betterment of both human, plant and animal life.;;Jack Brady;Jennifer Groarke, Marcus Hanratty, Sam Russell;https://readymag.website/u1772937991/4650793/planta/;YES - 1:19;https://youtu.be/2DmWAQN7HtY?si=TIsNITCe1LShu6ni;youtube;2DmWAQN7HtY;;
