ID_project;ID_tot;category;id;degree;course;ay;school;school_website;IMMAGINI;Polarità;PIAZZATO;title;subtitle;description;old_description;team;faculty;project_website;Video;Link Video;hasVideo;video_link;Column 17;
FDV_HUM_6;FDV_HUM_6;HUM;6;Bachelor Degree;Graduation Project: Sound Landscape;2024;Tongji University, College of Design and Innovation, Shanghai, China;http://tjdi.tongji.edu.cn ;Rhythmic community design for aging activities;Human  /  More Than Human;;Rhythmic Design for Aging Communities;The Anshan Community Example;Rhythmic Design for Aging Communities explores, through sound walking, the ever-changing sound environment of the Anshan community. Focusing particularly on the typical lifestyle of the elderly, it revealed their need for sound information during outdoor exercise activities. Based on the elderly's demand for structured activity patterns, a beat was identified as the key intervention point within the soundscape. To realize this concept, four physical sound devices, integrated with public fitness equipment, and three interactive sound devices were designed, establishing a prototype for a sports beat. To further harmonize the spatial soundscape, the project gathered sound materials from within the community. After rearranging and producing these sounds, they were used to create a unique sound for the “beat community,” designed to help the elderly establish exercise routines through sound, enhance fitness recovery, and draw attention to the specific hearing needs of this group.;;Yijie Gan;Simin Tao, Zhao Liu;;YES - 3:05;https://www.dropbox.com/scl/fi/2lojw7f24dx4actya0ehu/BEAT-OF-THE-STREET.mp4?rlkey=viv2ug2qjslz529yydx58lry0&st=z30eb6gn&dl=0;file;https://www.dropbox.com/scl/fi/2lojw7f24dx4actya0ehu/BEAT-OF-THE-STREET.mp4?rlkey=viv2ug2qjslz529yydx58lry0&st=z30eb6gn&dl=0;;
FDV_HUM_7;FDV_HUM_7;HUM;7;MSc Interior and Spatial Design;Interdisciplinary Workshop;2023/2024;Politecnico di Milano, School of Design, Milan, Italy;www.design.polimi.it;44_Hygrow;Human  /  More Than Human;Y;Hygrow;Water the Pot, Not the Plant!;HYGROW is a ceramic pot aiming at saving water and simplifying plant care. Designed to address water waste, air pollution and low sustainability awareness, HYGROW changes the way plants are watered by pouring water into the pot’s cavity rather than directly on the plant. The cavity contributes to creating a microclimate that mimics how plants naturally absorb water from the soil. /n To enhance biophilia, low-maintenance plants studied by NASA to purify air from pollutants were identified as ideal for the product. Additionally an NFC tag interaction within the pot connects users to the website where they can learn about product’s benefits and access plant care tips.;;Laura Fajenza, Gaia Foschini, Leonora Melli;Elena Mariele Elgani;https://www.figma.com/proto/2oLZr2G6BUMXRrOL7RTg8w/HYGROW_Website?page-id=0%3A1&node-id=2-100&p=f&viewport=742%2C892%2C0.32&t=CJf9lJZJ6Ke2aE5p-1&scaling=scale-down&content-scaling=fixed&starting-point-node-id=2%3A100;YES - 0:12;https://drive.google.com/file/d/1Wr2bJ4G5tiMgfsuEKXn8JQSsyHKBCEpQ/view?usp=sharing;file;https://drive.google.com/file/d/1Wr2bJ4G5tiMgfsuEKXn8JQSsyHKBCEpQ/view?usp=sharing;3318506842 Leonora;
FDV_HUM_8;FDV_HUM_8;HUM;8;Bachelors of Design;;2024;The Design Village, Noida, India;https://www.thedesignvillage.org/;FDV_HUM_8;Human  /  More Than Human;;Hyac;Transforming Invasiveness Into Innovation;Excessive water hyacinth growth in swamps is the cause of ecosystems disruption as well as environmental and economic challenges. To address such issues, Hyac is a bio-based material from water hyacinth, transforming an ecological conflict into opportunity by repurposing invasive plants into resources. By curating landscapes and mitigating negative impacts, the project’s outcome is a regenerative cycle of biomaterials that fosters harmony, balances human needs, and promotes ecological care.;;Aryaman Bhargava;Gaurav MK Wali;;;;;;;
FDV_HUM_9;FDV_HUM_9;HUM;9;BSc Product Design;Metadesign - Studio (P4);2024/2025;Politecnico di Milano, School of Design, Milan, Italy;www.productdesign.polimi.it/laurea-triennale/;23_Squeak;Human  /  More Than Human;Y;SQUEAK;For Your Rabbit;Squeak is a product designed for rabbits rather than their human owners. Born out of the sentence “less for better”, Squeak is a product that allows anyone who owns a rabbit to integrate vitamins and fibers deriving from food waste (vegetable and fruit peelings) in their little friend’s diet. /n Squeak helps humans reducing food waste, while being an alternative kind of entertainment for rabbits, bringing together perks for both humans and their more than human pet friends.;;Andrea Crippa, Michelangelo De Baggis, Davide Perencin, Dorian Plugaru;Daniela Maurer, Marina Parente, Carla Sedini;;YES - 0:45;https://youtu.be/epd0wGCY-6E;youtube;epd0wGCY-6E;Michelangelo 3479181174;
FDV_IND_1;FDV_IND_1;IND;1;Master's Degree - Designer in Sustainable Innovation;Diploma Project ;2024;BESIGN The Sustainable Design School, Nice, France;https://besignschool.com/;Living Tomorrow;Individual / Collective;;Living Tomorrow;Individual and Collective Fulfillment Through Accessible Student Housing;Living Tomorrow addresses the French student's housing challenges of high rent, inadequate or sub-standards living conditions, and limited mobility. Proposing a resilient and inclusive solution balancing accessibility with personal and collective well-being, the design includes individual spaces optimized for rest and work activities, and collective spaces fostering community coexistence (kitchens, coworking, relaxation). The modular homes are adaptable, designed for rehabilitation or reversible housing on unused land, supporting flexibility and sustainability through collaborative development.;;Indira Snellen, Killian Pupat;Laurent Bouzige;;;;;;;
FDV_IND_2;FDV_IND_2;IND;2;BA Création d’Intérieurs;Furniture Design / Furniture and Objects Design;2024/2025;ESA Saint-Luc Bruxelles, Brussels, Belgium;www.stluc-bruxelles-esa.be ;Echoes of Us;Individual / Collective;Y;Echoes of Us;Upcycled Pieces for Self-Expression and Collaboration in Care;Western Europe has three times the global average of children in care, and many of them cannot choose their belongings. Echoes of Us involves 6 upcycled wooden pieces that children can customize and assemble into a transportable box, reflecting their individuality. The pieces can also be reconfigured into a shared, abstract structure, promoting creativity and collaboration. Personal and collective elements are interconnected, encouraging both self-expression as well as the act of coming together as a community.;;Thomas Bertrand, Zoé Fredriksen;Jérémy Husquin, Maxence Matthieu;;;;;;;
FDV_IND_3;FDV_IND_3;IND;3;MEDes Product Design;Collaborative Futures;2024;Glasgow School of Art, School of innovation and Technology, Glasgow, Scotland ;https://www.gsa.ac.uk/;Decision making for the energy transition;Individual / Collective;;Decision-making for the Energy Transition ;Future Collective Decision-Making as Experiences of Energy for People and the Planet;Decision-making for the Energy Transition explores the emerging socio-technological characteristics of a hybrid system and how community decision-making might be informed by HACID technology.  Created with project partner NESTA and their Collective Intelligence design team, the project identifies the gap between individual and collective to inform not only the way decisions around energy might be made and its relationships with people locally, but also who is making these decisions and the role of policy makers in the future.;;Noah Albrectsen,  Leo Malins, Gabriella Moretti-Miles, Oona O’brien, Sophie-Anne Val;Aleks Berditchevskaia, Rita Marques, Marianne McAra, Zoe Prosser, Kirsty Ross;;YES - 2:07;https://www.dropbox.com/scl/fi/sdkjtmqcgu95glv4owm0h/GSA_Nesta_Milan_Video_with_sub_eng_final.mp4?rlkey=ytizt5aovbdg5s14xkkjzl60s&e=1&st=tw1d8qip&dl=0;file;https://www.dropbox.com/scl/fi/sdkjtmqcgu95glv4owm0h/GSA_Nesta_Milan_Video_with_sub_eng_final.mp4?rlkey=ytizt5aovbdg5s14xkkjzl60s&e=1&st=tw1d8qip&dl=0;;
FDV_IND_4;FDV_IND_4;IND;4;;Executive Course in User Experience Design;2024;POLI.design, Milano, Italy;https://www.polidesign.net/it/formazione/digital-and-interaction/corso--user-experience-design/;Polidesign_Wheele;Individual / Collective;;Wheele;An Inclusive Autonomous Car-Sharing To Organize Your Daily Life;Wheele is a UX design project sparked by Model 5’s concept car, redefining digital interaction in autonomous car-sharing. It choreographs seamless experiences across public (in-car screens) and private (personal mobile) interfaces, enabling inclusive, smart urban mobility. By merging personal devices with shared screens, Wheele enhances both individual control and collective accessibility, creating a fluid, user-centered experience that adapts to diverse needs in the evolving landscape of transportation.;;Francescopaolo Amendola, Sofia Bernardini, Federica Ciarallo, Giuditta Alevtina Pini, Gabriele Rabbito;Venanzio Arquilla, Davide Genco, Federica Caruso, Gabriele Malaspina, Roberta Tassi;https://www.figma.com/proto/8jc2iTDP0qhJ58Ua3i8nGx/G6---UXD-16?page-id=7291%3A18405&type=design&node-id=7291-21044&viewport=630%2C540%2C0.02&t=gRmtThZK4Zw5XJDC-1&scaling=min-zoom&starting-point-node-id=7291%3A21044&mode=design;No;;;;;
FDV_IND_5;FDV_IND_5;IND;5;Master's Degree Program in Design;;2024;University of Tsukuba, Graduate School of Comprehensive Human Sciences , Tsukuba, Japan;https://www.geijutsu.tsukuba.ac.jp/dpd/;Project 02;Individual / Collective;;Harmony Chairs;Interactive Rocking Chairs for Shared Musical Experiences;Harmony Chairs are interactive rocking chairs that produce sounds in response to rocking motion and synchronization. In modern public spaces, spontaneous interaction among strangers has diminished as people increasingly focus on their personal devices. Harmony Chairs aims to revive such interactions by offering a playful and shared experience. This interactive installation consists of three rocking chairs, equipped with accelerometers and speakers, and designed to respond to users’ movements. Each chair has a unique set of pitches assigned to it. When a person rocks a chair individually, it produces soft, soothing sounds, still the real magic happens when users begin to interact with each other. As two or more users synchronize their movements, the chairs generate distinct bell-like tones that are clear and harmonious. This auditory feedback encourages users to align their movements, creating a shared goal and fostering a sense of connection, turning strangers into collaborators.;;Miwa Yoshihara;Shinichi Koyama;;YES - 2:00;https://drive.google.com/file/d/1Y4p18dZYDI7nX_pxn3gMzeiEP1VUwRBT/view?usp=sharing;file;https://drive.google.com/file/d/1Y4p18dZYDI7nX_pxn3gMzeiEP1VUwRBT/view?usp=sharing;;
FDV_MAT_1;FDV_MAT_1;MAT;1;BA Création d’Intérieurs;Furniture Design / Furniture and Objects Design;2024/2025;ESA Saint-Luc Bruxelles, Brussels, Belgium;www.stluc-bruxelles-esa.be ;Project 01;Materialistic / Spiritual;;Alphablocs;Playfully Learning Letters and Numbers Through Two Simple Shapes;Alphablocs is an educational object for children aged 5-6. Made from two simple yet versatile shapes, obtained from recycled wood panel offcuts, it helps children learn to write letters and numbers turning children’s thoughts into tangible creations. By shaping and assembling forms, kids can explore meaningful links between mind and matter in a playful, enriching way, while fostering creativity through free play, self-expression, and discovery.;;Adèle Remacle, Alix Sironval;Jérémy Husquin, Maxence Matthieu;;;;;;;
FDV_MAT_10;FDV_MAT_10;MAT;10;MSc Architecture, Built Environment, Interiors;Interior Design Studio;2024/2025 ;Politecnico di Milano, School of Architecture, Urban Planning and Construction Engineering, Milan, Italia;https://www.polimi.it/;Architettura_Faroldi;Materialistic / Spiritual;;GRAVITAS;A Sacred Space in Brera;GRAVITAS explores the act of designing a sacred space and what it means to work with codes that deal with a material reality flanked by another dimension that corroborates it and constitutes its essence. Empties and fullnesses alternate, to create pauses and tensions typical of an architecture that identifies suspension and interlocking as the morphological tools of a semantics of contemplation, characteristic of places dedicated to thought and prayer. Depriving the architectural material of its gravity and heaviness and maintaining its being the substance of hoped-for things, the project becomes the graphic link between the earthly tectonic experience and another place of which the experience of architecture attempts to represent its ethereal essence.;;Luca Faroldi, Giulia Grifoni, Letizia Vairetti;Matteo Umberto Poli, Pierluigi Salvadeo;;;;;;;
FDV_MAT_11;FDV_MAT_11;MAT;11;Industrial Design;;2024;Kyushu University, School of Design, Fukuoka, Japan;https://www.design.kyushu-u.ac.jp/;Yorigokoro;Materialistic / Spiritual;;YORIGOKORO;Safe Spaces Against Self-Negation;In Japan, the number of people suffering from mental illness is increasing every year. Self-negation is one of the reasons of mental illness, affecting particularly, those in the “gray zone of developmental disorders”. YORIGOKORO serves as a platform to prepare a better place for one's mind, where self-negation can be handled. Physically, YORIGOKORO presents as a coffer where people can store items that will serve as a source of emotional comfort, when the mind is too tired to move. It also provides a sense of security, telling users that their item “is here, so I'll be okay” even when not in use. YORIGOKORO materializes the sense of security and comfort through “safe objects” and the ritual action of opening and closing the box, which encourages a change of mindset in the user.;;Sara Nakano;Yasuyuki Hirai;;YES;;file;;;
FDV_MAT_12;FDV_MAT_12;MAT;12;MSc Interior and spatial design;Landscape and Interior - Spatial Design 2;2023/2024;Politecnico di Milano, School of Design, Milan, Italy;www.design.polimi.it;FDV_MAT_12;Materialistic / Spiritual;;Courage is RESILIENCE;Design is Courage;Courage is RESILIENCE is designed to transform the abstract concept of courage into a tangible environment. Created at the interaction between mental and physical realms, this installation evokes two distinct perceptions: from the outside, it appears as an obscure enclosed area, while from the inside, it surrounds visitors with a nature-inspired setting that unfolds through personal engagement. In an attempt to find order within chaos, the design merges regular geometric forms with erratic wood branches, creating a captivating and immersive experience.;;Dina Abdelhalim, Bhargavi Baradkar, Giuditta Fucchi, Fatima Mattar;Michele De Lucchi, Francesca Balena Arista, Marco De Santi, Francesco Clerici, Giada Boromello, Nicolò Chierichetti, Alessia Soressi;;YES - 2:00;https://we.tl/t-J9i7uZvXfR;file;https://we.tl/t-J9i7uZvXfR;;
FDV_MAT_2;FDV_MAT_2;MAT;2;MA Design for Body & Environment;;2024;National College of Art and Design (NCAD), Department of Design for the Body, Dublin, Ireland;https://www.ncad.ie/;Burial Shrouds;Materialistic / Spiritual;;Burial Shrouds;Reflective Practices Addressing Grief, Loss, and the Intersections of Personal and Global Tragedies;Burial Shrouds focuses on the principles of making, learning, noticing, and caring through reflective weaving and design practice. In a world facing crisis, biodiversity loss and despair it reflects on our relationship with creativity and spiritual fulfilment, creating multi-dimensional woven pieces from hemp and linen that are tactile, dynamic, and interactive, designed to be touched and explored. Burial Shrouds examines creativity through the lens of grief following an unexpected death, juxtaposing intangible spiritual emotions with tangible, material expressions of loss and remembrance.;"Burial Shrouds focuses on the principles of making, learning, noticing, and caring through reflective weaving and design practice. In a world facing crisis, biodiversity loss and despair it reflects on our relationship with creativity and spiritual fulfilment, creating multi-dimensional woven pieces from hemp and linen that are tactile, dynamic, and interactive; designed to be touched and explored. Burial Shrouds examines creativity through the lens of grief following an unexpected death, juxtaposing intangible spiritual emotions with tangible, material expressions of loss and remembrance.";Dobrawa Brach Kalzuna;Kathy Mooney, Angela O'Kelly, Rachel Tuffy;https://weave-and-dye.squarespace.com/;;;;;;
FDV_MAT_3;FDV_MAT_3;MAT;3;BA Product Design ;International Design Studio;2024;Nottingham Trent University, Department of Product Design, Nottingham, United Kingdom;www.ntu.ac.uk/course/product-design;A second purpose;Materialistic / Spiritual;Y;A Second Purpose;New Life for Household Waste ;A Second Purpose is a collaborative international project that explores design interventions for repurposing discarded objects. Vessels from household waste were selected and additive components to transform them into functional, desirable products for displaying flowers were designed and developed. The components, produced using 3D printing, were designed for the giftware market, focusing on sustainability, consumer ownership, creating nostalgic connections and breathing new life into seemingly obsolete objects.;;Tessa Benning, Siyu Chen, Angela Yu;Grant Baker, Judith van Weert-Deckers, Jingling Zhang;www.internationaldesignstudio.co.uk;;;;;;
FDV_MAT_4;FDV_MAT_4;MAT;4;Bachelor's Degree;Graduation Project;2023/2024;Tsinghua University, Department of Arts and Crafts, Beijing, China;https://www.tsinghua.edu.cn;Investigation#;Materialistic / Spiritual;;Investigation#;Engineering Drawing in Jewelry Design;Investigation# explores whether in the context of jewelry design, the technical language of engineering drawings, used to measure inlays and create mounting frames, has inherent characteristics, rather than being a neutral, self-evident discourse. In its exploration the project employs steel frames made through the forms of engineering drawing to inlay various dried fruits, questioning whether the measurement results are perfectly accurate, or are they subjective assumptions, hard to fully define. Investigation# seeks for references in the relationships between theoretical measurements and their material application, their meaning and their presence, their implications and their evidence.;;Zhou Heyang;Wang Xiaoxin;https://exhibition.ad.tsinghua.edu.cn/2023/;YES - 1:24;https://youtu.be/Whhh7Z9TC94?si=_w9DYio57Ib65RWG;youtube;Whhh7Z9TC94;;
FDV_MAT_5;FDV_MAT_5;MAT;5;Bachelor's Degree;;2024;Universidade de São Paulo, Faculdade de Arquitetura e Urbanismo e de Design, São Paulo, Brazil;https://www.fau.usp.br/;Project 01;Materialistic / Spiritual;;Apuá;Changing the Climate of Play;Apuá is a toy brand that fosters environmental empathy through play, inspiring future generations to protect the Earth. Apuá's Save the Penguin toy demonstrates the power of design to address urgent global challenges, such as climate change, engaging kids through the universal language of play. By focusing on children, it fosters the development of the next generation of climate and environmental stewards, cultivating empathy, curiosity, and confidence to imagine and create a more sustainable future.;;Ana Clara Pasqua Paulino, Maryanne Cerqueira, Keyske Higa, João Vitor de Sá, Gabriel Codognato;Denise Dantas, Sara Goldchmit;https://www.youtube.com/watch?v=rNJgLphC3dQ;YES - 1:00;https://www.youtube.com/watch?v=rNJgLphC3dQ;youtube;rNJgLphC3dQ;;
FDV_MAT_6;FDV_MAT_6;MAT;6;MA Fashion & Technology;Fashion Design MA 3;2024;University of Arts Linz, Institute of Space and Design, Linz, Austria;www.kunstuni-linz.at;PULMONAUT;Materialistic / Spiritual;;PULMONAUT;Craftsmanship, Technology and Design Through the Science of Breathing and the Art of Glass-blowing;In a digitally driven world, Pulmonaut explores breathing as a technology and universal language of connection. Merging scientific glassblowing in a contemporary fashion context, flexible glass sculptures visualize the spiritual essence of mindful breathing and movement. Flowing with fire while feeling through breath, glass embodies a symphony of surgical craftsmanship. Co-created with master craftsman Günther Mausz, this project highlights the power of multidisciplinary collaboration, amplifying craftsmanship as an art of our future and breathing as a technology of our present.;;Lia Larrea, Günther Mausz;Karin Krapfenbauer, Sander Hofstee, Ute Ploier;lialarrea.com;YES - 2:50;https://youtu.be/lZACz-fC7v8;youtube;lZACz-fC7v8;;
FDV_MAT_7;FDV_MAT_7;MAT;7;Bachelor of Design;Design Honours Project;2024;University of New South Wales (UNSW), Faculty of Arts, Design and Architecture, School of Art & Design,, Sydney, Australia;https://www.unsw.edu.au/arts-design-architecture/our-schools/art-design;Transparent paths;Materialistic / Spiritual;;Transparent Paths ;Reframing Waste as a Precious Resource;Single-use plastic pallet wrap is used widely in the transportation industry for convenience and efficiency, and accounts for 1.5% of global plastic waste. Transparent Paths reimagines the value of waste pallet wrap, repurposing it into strong, luminous yarn to be woven. Engaging with waste material through the meditative act of weaving a reflective practice is fostered, promoting both spiritual well-being and sustainability in a world shaped by overconsumption. The woven textiles reframe waste as a valuable resource for reuse.;;Lilli Taranto;Katherine Moline, Chantelle Baistow;•	https://lilt--studio.squarespace.com/work/transparentpaths ;YES - 5:34;https://www.youtube.com/watch?v=5UJPEBmsv2I;youtube;5UJPEBmsv2I;;
FDV_MAT_8;FDV_MAT_8;MAT;8;Industrial Design;;2024;Kyushu University, School of Design, Fukuoka, Japan;https://www.design.kyushu-u.ac.jp/en/home/;Sole and Soul;Materialistic / Spiritual;Y;Sole and Soul;Exploring the Material and Spiritual Essence of Footwear;Shoes are more than material possessions: they shape our identity and movement through the world. Sole and Soul investigates the duality of the material and the spiritual in footwear utilizing Kyushu’s regional materials and Vibram’s advanced technology. Guided by a Design Narratives Worldmaking (DNW) approach, the project explores how shoes can go beyond function to embody cultural narratives, values, and the interplay between physical craftsmanship and deeper meaning.;"Shoes are more than material possessions; they shape our identity and movement through the world. Sole and Soul investigates the duality of the material and the spiritual in footwear utilizing Kyushu’s regional materials and Vibram’s advanced technology. Guided by a Design Narratives Worldmaking (DNW) approach, the project explores how shoes can go beyond function to embody cultural narratives, values, and the interplay between physical craftsmanship and deeper meaning.";Kotoko Aratani, Yamato Ito, Kasumi Oki, Misaki Otaguro, Kilinc Yoheisuleyman;Yasuyuki Hayama, Masaya Hashimoto;;YES;;;;;
FDV_MAT_9;FDV_MAT_9;MAT;9;MSc Architecture, Built Environment, Interiors;Interior Design Studio;2024/2025 ;Politecnico di Milano, School of Architecture, Urban Planning and Construction Engineering, Milan, Italy;https://www.polimi.it/;Architettura_Salvadeo;Materialistic / Spiritual;;SOTTO | SUONO;Sound as a Social and Spiritual Bond;This project explores the role of a sacred space in a big city’s life, like that of Milano. In a reality where sacred seems completely detached to daily, music is the answer to this inclusion problem: the sound of a choir or prayers immediately reminds us about the numinous and can be recognizable by everyone, even from a busy street and even from a mass underground. The sacred space, represented by church of San Sepolcro in Milan, presents an underground level, where three different devices hide the pipe organ, the choir and the prayer sound, that spread through the upper level, and a little square, where everyone can interact with the church, bringing the spiritual element of this project to everyone in their daily lives.;;Fabio Girelli, Camilla Margherita Giussani, Alessandra Introini;Matteo Umberto Poli, Pierluigi Salvadeo;;YES - 01:49;https://1drv.ms/v/c/94a5dcbbcd78dd6f/EbMuNPMkT4hJji9k0pPgSrIBKTQT61TpEWcGx6Ju1qWq6Q?e=0vNIuo;file;https://1drv.ms/v/c/94a5dcbbcd78dd6f/EbMuNPMkT4hJji9k0pPgSrIBKTQT61TpEWcGx6Ju1qWq6Q?e=0vNIuo;;
FDV_OBE_1;FDV_OBE_1;OBE;1;BA Graphic Design ;;2024/2025;Loughborough University, School of Design and Creative Arts, Loughborough, United Kingdom;https://www.lboro.ac.uk/;Project 02;Obedience / Disobedience;;Deepfakes & Misinformation ;Countering AI-Driven Deception in the Digital Age;The rapid rise of Artificial Intelligence has fueled the spread of deepfakes and misinformation in the digital age, eroding trust and distorting reality. Deepfakes & Misinformation introduces ‘Artificial Alerts,’ a solution to expose the risks of digital deception and highlight the need for transparency. Through a visual campaign and innovative metadata UI concept, the project raises awareness of AI-driven misinformation, empowering audiences to navigate the digital world confidently while exploring how design can rebuild trust between artificial systems and natural human perception.;;Fraser Rollafson ;Charlie Henshaw, Rhiannon Payne, Jem Robinson;https://youtu.be/k3HYSOvIML0;NO;;;;;
